{
  "type": "object",
  "properties": {
    "version": {
      "type": "string",
      "const": "v1"
    },
    "id": {
      "type": "string",
      "minLength": 1
    },
    "name": {
      "type": "string",
      "minLength": 1
    },
    "method": {
      "type": "string",
      "enum": [
        "GET",
        "POST",
        "PUT",
        "PATCH",
        "DELETE",
        "HEAD",
        "OPTIONS"
      ],
      "default": "GET"
    },
    "url": {
      "type": "string",
      "minLength": 1
    },
    "headers": {
      "type": "object",
      "additionalProperties": {
        "type": "string"
      },
      "default": {}
    },
    "body": {
      "anyOf": [
        {
          "type": "string"
        },
        {
          "type": "object",
          "additionalProperties": {}
        }
      ]
    }
  },
  "required": [
    "version",
    "id",
    "name",
    "url"
  ],
  "additionalProperties": false,
  "$schema": "http://json-schema.org/draft-07/schema#"
}
